{
  "$id": "https://lineage.local/schema/lineage-corpus-v1.json",
  "$schema": "https://json-schema.org/draft/2020-12/schema",
  "additionalProperties": false,
  "properties": {
    "assets": {
      "items": {
        "additionalProperties": false,
        "properties": {
          "byteSize": {
            "minimum": 0,
            "type": "integer"
          },
          "id": {
            "minLength": 1,
            "type": "string"
          },
          "mediaType": {
            "minLength": 1,
            "type": "string"
          },
          "path": {
            "minLength": 1,
            "pattern": "^assets/[A-Za-z0-9._/-]+$",
            "type": "string"
          },
          "sha256": {
            "pattern": "^[a-f0-9]{64}$",
            "type": "string"
          }
        },
        "required": [
          "id",
          "mediaType",
          "byteSize",
          "sha256",
          "path"
        ],
        "type": "object"
      },
      "type": "array"
    },
    "corpusId": {
      "minLength": 1,
      "type": "string"
    },
    "format": {
      "const": "lineage.corpus"
    },
    "formatVersion": {
      "const": 1
    },
    "prompts": {
      "items": {
        "additionalProperties": false,
        "properties": {
          "challenge": {
            "items": {
              "type": "string"
            },
            "type": "array"
          },
          "clozeTargets": {
            "items": {
              "additionalProperties": false,
              "properties": {
                "answer": {
                  "minLength": 1,
                  "type": "string"
                },
                "hints": {
                  "items": {
                    "type": "string"
                  },
                  "type": "array"
                },
                "id": {
                  "minLength": 1,
                  "type": "string"
                }
              },
              "required": [
                "id",
                "answer"
              ],
              "type": "object"
            },
            "minItems": 1,
            "type": "array"
          },
          "id": {
            "minLength": 1,
            "type": "string"
          },
          "kind": {
            "enum": [
              "basic",
              "cloze",
              "image-occlusion"
            ]
          },
          "occlusionRegions": {
            "items": {
              "additionalProperties": false,
              "properties": {
                "accessibleDescription": {
                  "minLength": 1,
                  "type": "string"
                },
                "geometry": {
                  "oneOf": [
                    {
                      "additionalProperties": false,
                      "properties": {
                        "height": {
                          "maximum": 1,
                          "minimum": 0,
                          "type": "number"
                        },
                        "type": {
                          "const": "rectangle"
                        },
                        "width": {
                          "maximum": 1,
                          "minimum": 0,
                          "type": "number"
                        },
                        "x": {
                          "maximum": 1,
                          "minimum": 0,
                          "type": "number"
                        },
                        "y": {
                          "maximum": 1,
                          "minimum": 0,
                          "type": "number"
                        }
                      },
                      "required": [
                        "type",
                        "x",
                        "y",
                        "width",
                        "height"
                      ],
                      "type": "object"
                    },
                    {
                      "additionalProperties": false,
                      "properties": {
                        "points": {
                          "items": {
                            "additionalProperties": false,
                            "properties": {
                              "x": {
                                "maximum": 1,
                                "minimum": 0,
                                "type": "number"
                              },
                              "y": {
                                "maximum": 1,
                                "minimum": 0,
                                "type": "number"
                              }
                            },
                            "required": [
                              "x",
                              "y"
                            ],
                            "type": "object"
                          },
                          "minItems": 3,
                          "type": "array"
                        },
                        "type": {
                          "const": "polygon"
                        }
                      },
                      "required": [
                        "type",
                        "points"
                      ],
                      "type": "object"
                    }
                  ]
                },
                "id": {
                  "minLength": 1,
                  "type": "string"
                },
                "label": {
                  "minLength": 1,
                  "type": "string"
                }
              },
              "required": [
                "id",
                "label",
                "geometry",
                "accessibleDescription"
              ],
              "type": "object"
            },
            "minItems": 1,
            "type": "array"
          },
          "resolution": {
            "items": {
              "type": "string"
            },
            "type": "array"
          },
          "response": {
            "oneOf": [
              {
                "const": "text"
              },
              {
                "additionalProperties": false,
                "properties": {
                  "capture": {
                    "const": "none"
                  },
                  "mode": {
                    "const": "self-check"
                  }
                },
                "required": [
                  "mode",
                  "capture"
                ],
                "type": "object"
              }
            ]
          },
          "revision": {
            "minimum": 1,
            "type": "integer"
          },
          "sourceAsset": {
            "minLength": 1,
            "type": "string"
          },
          "withheld": {
            "items": {
              "type": "string"
            },
            "minItems": 1,
            "type": "array"
          }
        },
        "required": [
          "id",
          "revision",
          "kind",
          "challenge",
          "withheld",
          "resolution",
          "response"
        ],
        "type": "object"
      },
      "type": "array"
    }
  },
  "required": [
    "format",
    "formatVersion",
    "corpusId",
    "prompts"
  ],
  "title": "Lineage corpus version 1",
  "type": "object"
}
